{
  "$schema": "https://json-schema.org/draft/2020-12/schema",
  "$id": "https://example.local/ml-platform-study/contracts/dataset.schema.json",
  "title": "Parquet Dataset Metadata Contract",
  "type": "object",
  "additionalProperties": false,
  "required": [
    "schema_version",
    "dataset_id",
    "version",
    "classification",
    "owner",
    "storage",
    "format",
    "partitions",
    "schema",
    "evolution",
    "files",
    "checksums",
    "license",
    "provenance"
  ],
  "properties": {
    "schema_version": {
      "type": "string",
      "pattern": "^1\\.0\\.0$"
    },
    "dataset_id": {
      "$ref": "#/$defs/portableName"
    },
    "version": {
      "type": "string",
      "pattern": "^v\\d{4}$"
    },
    "classification": {
      "type": "string",
      "enum": ["public", "internal", "confidential", "restricted"]
    },
    "owner": {
      "$ref": "#/$defs/portableName"
    },
    "storage": {
      "type": "object",
      "additionalProperties": false,
      "required": ["bucket", "prefix"],
      "properties": {
        "bucket": {
          "type": "string",
          "pattern": "^ml-platform-[a-z0-9-]+$"
        },
        "prefix": {
          "$ref": "#/$defs/objectPrefix"
        }
      }
    },
    "format": {
      "type": "object",
      "additionalProperties": false,
      "required": ["type", "compression", "row_group_target_mib"],
      "properties": {
        "type": {
          "type": "string",
          "const": "parquet"
        },
        "compression": {
          "type": "string",
          "enum": ["zstd", "snappy", "gzip", "none"]
        },
        "row_group_target_mib": {
          "type": "integer",
          "minimum": 16,
          "maximum": 512
        }
      }
    },
    "partitions": {
      "type": "object",
      "additionalProperties": false,
      "required": ["columns", "template"],
      "properties": {
        "columns": {
          "type": "array",
          "items": {
            "$ref": "#/$defs/snakeName"
          }
        },
        "template": {
          "type": "string",
          "pattern": "^([a-z][a-z0-9_]*=\\{[a-z][a-z0-9_]*\\}/)*$"
        }
      }
    },
    "schema": {
      "type": "object",
      "additionalProperties": false,
      "required": ["name", "version", "fields"],
      "properties": {
        "name": {
          "$ref": "#/$defs/portableName"
        },
        "version": {
          "type": "string",
          "pattern": "^\\d+\\.\\d+\\.\\d+$"
        },
        "fields": {
          "type": "array",
          "minItems": 1,
          "items": {
            "$ref": "#/$defs/field"
          }
        }
      }
    },
    "evolution": {
      "type": "object",
      "additionalProperties": false,
      "required": ["compatibility", "compatible_changes", "breaking_changes"],
      "properties": {
        "compatibility": {
          "type": "string",
          "enum": ["backward", "forward", "full", "none"]
        },
        "compatible_changes": {
          "type": "array",
          "minItems": 1,
          "items": {
            "$ref": "#/$defs/evolutionChange"
          }
        },
        "breaking_changes": {
          "type": "array",
          "minItems": 1,
          "items": {
            "$ref": "#/$defs/evolutionChange"
          }
        }
      }
    },
    "files": {
      "type": "object",
      "additionalProperties": false,
      "required": ["target_file_size_mib", "max_file_size_mib", "allow_small_files", "estimated_file_count"],
      "properties": {
        "target_file_size_mib": {
          "type": "integer",
          "minimum": 1,
          "maximum": 512
        },
        "max_file_size_mib": {
          "type": "integer",
          "minimum": 1,
          "maximum": 1024
        },
        "allow_small_files": {
          "type": "boolean"
        },
        "estimated_file_count": {
          "type": "integer",
          "minimum": 0
        }
      }
    },
    "checksums": {
      "type": "object",
      "additionalProperties": false,
      "required": ["mode", "algorithm", "manifest"],
      "properties": {
        "mode": {
          "type": "string",
          "enum": ["manifest", "per-file", "partition-manifest"]
        },
        "algorithm": {
          "type": "string",
          "const": "sha256"
        },
        "manifest": {
          "$ref": "#/$defs/objectPath"
        }
      }
    },
    "license": {
      "type": "object",
      "additionalProperties": false,
      "required": ["kind", "expression", "review_status"],
      "properties": {
        "kind": {
          "type": "string",
          "enum": ["spdx", "custom", "unknown"]
        },
        "expression": {
          "type": "string",
          "minLength": 1,
          "maxLength": 256
        },
        "review_status": {
          "type": "string",
          "enum": ["accepted", "review-required", "rejected", "unknown"]
        }
      }
    },
    "provenance": {
      "type": "object",
      "additionalProperties": false,
      "required": ["source_type", "source_uri", "created_at"],
      "properties": {
        "source_type": {
          "type": "string",
          "enum": ["synthetic", "public-download", "generated", "internal-upload", "derived"]
        },
        "source_uri": {
          "type": "string",
          "minLength": 1,
          "maxLength": 512
        },
        "created_at": {
          "$ref": "#/$defs/isoTimestamp"
        }
      }
    }
  },
  "$defs": {
    "field": {
      "type": "object",
      "additionalProperties": false,
      "required": ["name", "type", "nullable", "description", "categorical"],
      "properties": {
        "name": {
          "$ref": "#/$defs/snakeName"
        },
        "type": {
          "type": "string",
          "enum": [
            "string",
            "boolean",
            "int32",
            "int64",
            "float32",
            "float64",
            "decimal",
            "date",
            "timestamp",
            "binary"
          ]
        },
        "nullable": {
          "type": "boolean"
        },
        "description": {
          "type": "string",
          "minLength": 1,
          "maxLength": 512
        },
        "timestamp": {
          "type": "object",
          "additionalProperties": false,
          "required": ["timezone", "unit"],
          "properties": {
            "timezone": {
              "type": "string",
              "const": "UTC"
            },
            "unit": {
              "type": "string",
              "enum": ["ms", "us", "ns"]
            }
          }
        },
        "categorical": {
          "type": "object",
          "additionalProperties": false,
          "required": ["encoding"],
          "properties": {
            "encoding": {
              "type": "string",
              "enum": ["none", "plain-string", "dictionary", "integer-coded", "boolean"]
            },
            "allowed_values": {
              "type": "array",
              "items": {
                "type": "string",
                "minLength": 1,
                "maxLength": 128
              }
            },
            "code_map": {
              "type": "object",
              "additionalProperties": {
                "type": "string",
                "minLength": 1,
                "maxLength": 128
              }
            },
            "unknown_value": {
              "type": ["string", "null"],
              "maxLength": 128
            }
          }
        }
      }
    },
    "evolutionChange": {
      "type": "object",
      "additionalProperties": false,
      "required": ["change", "reason"],
      "properties": {
        "change": {
          "type": "string",
          "enum": [
            "add-nullable-field",
            "add-categorical-value",
            "widen-numeric-type",
            "add-optional-metadata",
            "remove-field",
            "rename-field",
            "change-nullability",
            "change-timestamp-timezone",
            "change-categorical-encoding"
          ]
        },
        "reason": {
          "type": "string",
          "minLength": 1,
          "maxLength": 512
        }
      }
    },
    "portableName": {
      "type": "string",
      "minLength": 3,
      "maxLength": 63,
      "pattern": "^(?!.*(?:password|passwd|secret|token|credential|apikey|api-key|email|user|konrad))[a-z0-9]([-a-z0-9]*[a-z0-9])?$"
    },
    "snakeName": {
      "type": "string",
      "minLength": 1,
      "maxLength": 63,
      "pattern": "^(?!.*(?:password|passwd|secret|token|credential|apikey|api-key|email|user|konrad))[a-z][a-z0-9_]*$"
    },
    "objectPrefix": {
      "type": "string",
      "minLength": 3,
      "maxLength": 512,
      "pattern": "^(?!/)(?!.*//)(?!.*\\.\\.)(?!.*(?:password|passwd|secret|token|credential|apikey|api-key|email|user|konrad))[a-z0-9][a-z0-9/_=.-]*/$"
    },
    "objectPath": {
      "type": "string",
      "minLength": 1,
      "maxLength": 512,
      "pattern": "^(?!/)(?!.*//)(?!.*\\.\\.)(?!.*(?:password|passwd|secret|token|credential|apikey|api-key|email|user|konrad))[a-z0-9][a-z0-9/_=.-]*$"
    },
    "isoTimestamp": {
      "type": "string",
      "pattern": "^\\d{4}-\\d{2}-\\d{2}T\\d{2}:\\d{2}:\\d{2}Z$"
    }
  }
}
